{
  "$schema": "https://protocol.agora.dev/v1/schema.json",
  "version": "1.0",
  "store": {
    "name": "Test Store",
    "url": "https://example.com",
    "description": "A test store",
    "categories": ["apparel", "shoes"],
    "currency": "USD",
    "locale": "en-US"
  },
  "capabilities": {
    "products": "/api/agora/products",
    "product": "/api/agora/products/{id}",
    "search": "/api/agora/search"
  },
  "auth": { "type": "none" },
  "rate_limits": { "requests_per_minute": 60, "burst": 10 },
  "data_policy": { "cache_ttl": 3600, "attribution_required": true, "commercial_use": true }
}
